1,Black Panther,Ryan Coogler,Fantasy,0,0;51;6;Black Panther, directed by Ryan Coogler, tells the story of the new King T'Challa of Wakanda who must learn to handle the responsibilities of this title. Chadwick Boseman reprises his role as the Black Panther and goes up against his nemesis Killmonger, played by Michael B. Jordan.;Andy Serkis was really loving the freedom of acting without a motion capture suit. He made it rain in the casino.;I loved at the end when the rhino stops charging just to lick Okoye's face. Just because a couple is fighting, doesn't mean the family dog(rhino) isn’t going to keep showing some love.;Good film;
2,The Shawshank Redemption,Frank Darabont,Drama,0,0;15;3;I was expecting something else entirely to a better movie. Sorry not impressed me so even give birth. The only thing I liked was how they interpreted actors. Otherwise ... no comment.;How so, where superheroes in idiotic costumes with pretentious speeches? Sad thing is that films as of that level are no longer making ... films with meaning.;New comment added by Konrad Sikora;
3,The Godfather,Francis Ford Coppola,Drama,0,0;30;4;Greatest movie ever. Al Pacino and Marlon Brando were excellent.;I must say, this is one of the best films of all time. There is nothing wrong with it. The plot is fantastic, the characters are very flowing. Al Pacino's performance is outstanding, there's nothing I can say to him. One of the best masterpieces of Francis Ford Coppola.....;
4,The Dark Knight,Christopher Nolan,Action,0,0;17;4;The Dark Knight is hardly routine--it has a kicky sadism in scene after scene, which keeps you on edge and sends you out onto the street with post-movie stress disorder.;You come away impressed, oppressed, provoked, and beaten down, holding on to Ledger's squirrelly incandescence as a beacon in the darkness.;
5,12 Angry Men,Sidney Lumet,Crime,0,0;20;2;This film is, without any doubt, a masterpiece and one of the best films of all time. It is undoubtedly a must-see movie.;Classic movie with a very intelligent plot about the US court system and great dialogues. Everyone who loves movie should see this film.;Utterly spectacular film.It is about responsibility to all of us.Film tells us how it is bad to be apolitical.;
6,Pulp Fiction,Quentin Tarantino,Drama,0,0;126;12;We are movie fanatics who watched this cinematic pile of crap with seven other people ranging in age from 22 to 86. We watch a lot of movies in all genres, and we all thought it was the most overrated piece of vulgar garbage with gratuitous violence;This movie is really really good, but just...strange. After you finish watching it, it leaves you with a strange feeling.;
7,Schindler's List,Steven Spielberg,Drama,0,0;22;4;
8,Inception,Christopher Nolan,Action,0,0;55;7;test;
9,Forrest Gump,Robert Zemeckis,Drama,0,0;16;2;test;
